Name,Address,Fees,Placement,Hostel,Transportation,Link
L.D. College of Engineering,"GMV Complex, Nr. Nehru Bridge, Ahmedabad, Gujarat 380015","Approx 1,800 per year",75% ,Yes,Yes, https://ldce.ac.in/
Vishwakarma Government Engineering College,"69, Shri Hari Estate, Panna Estate Rd, Ahmedabad - 380006","Approx 1,500  per year",60% (Approximate),Yes,Yes,https://www.vgecg.ac.in/
Nirma University,"Nr. Ashram Road, Ahmedabad, Gujarat 382455","1,02,500 per semester",100%,Yes,Yes,https://www.nirmauni.ac.in/
LJ University,"LJ Campus, LJ College Rd, near Sanand - Sarkhej Road, Makarba, Sarkhej-Okaf, Gujarat 382210","Aprox 73,000  per year",N/A,N/A,N/A,https://www.ljku.edu.in/
Ahmedabad University,"Commerce Six Roads, Naranpark Society, Navrangpura, Ahmedabad, Gujarat 380009","3,50,000  per year",91%,yes,Yes,https://ahduni.edu.in/
