Question,optionA,optionB,optionC,optionD,Answer
"Q.What does the term ""keyframe"" refer to in animation?",A) The first frame of a sequence,B) A frame that defines the starting or ending points of any smooth transition,C) A frame with a key moment in the story,D) A frame with a critical error,Answer: B
Q. Which animation technique involves creating the illusion of movement by filming a sequence of hand-drawn or digitally created images?,A) Stop motion,B) 2D animation,C) 3D animation,D) Claymation,Answer: B
"Q. What is the purpose of the ""timeline"" in animation software?",A) To display a list of characters,B) To show the chronological sequence of frames,C) To organize sound effects,D) To create background images,Answer: B
Q. Which term refers to the process of giving human-like characteristics to non-human characters or objects in animation?,A) Morphing,B) Anthropomorphism,C) Kinematics,D) Rigging,Answer: B
"Q. In 3D animation, what is ""rigging""?",A) Creating the storyline,B) Designing characters,C) Adding lighting effects,D) Creating a digital skeleton for characters,Answer: D
"Q. What is the purpose of the ""onion skinning"" feature in animation software?",A) To add a translucent onion image to frames,B) To help animators see previous and upcoming frames as a reference while working on the current frame,C) To simulate the smell of onions during animation,D) To create a layered effect in animations,Answer: B
Q. Which animation technique involves manipulating real-world objects frame by frame to create movement?,A) 2D animation,B) Stop motion,C) Computer-generated imagery (CGI),D) Claymation,Answer: B
"Q. What is ""morphing"" in the context of animation?",A) Creating seamless transitions between different images,B) Adding music to animations,C) Creating motion blur effects,D) Rendering final frames,Answer: A
Q. Which software is widely used for 3D animation in the film and gaming industry?,A) Adobe Flash,B) Autodesk Maya,C) Toon Boom Harmony,D) After Effects,Answer: B
Q. What is the term for the process of creating movement by gradually changing one image into another?,A) Tweening,B) Blurring,C) Rendering,D) Looping,Answer: A
"Q. In animation, what does ""FPS"" stand for?",A) Frames Per Second,B) Flash Player Software,C) Film Production System,D) Frames Produced Sequentially,Answer: A
"Q. What is the ""Golden Age of Animation"" often referred to?",A) The 1950s,B) The 1980s,C) The 1930s and 1940s,D) The 2000s,Answer: C
"Q. Which animation studio is known for producing films like ""Toy Story,"" ""Finding Nemo,"" and ""Up""?",A) DreamWorks Animation,B) Pixar Animation Studios,C) Walt Disney Animation Studios,D) Studio Ghibli,Answer: B
"Q. What is the primary function of the ""storyboard"" in animation?",A) To create characters,B) To plan the visual narrative of an animation,C) To add sound effects,D) To color the frames,Answer: B
Q. Which animation technique involves creating characters and scenes by shaping and molding materials such as clay?,A) 2D animation,B) Stop motion,C) CGI animation,D) Rotoscoping,Answer: B
"Q. In animation, what is the purpose of the ""spline""?",A) To connect different frames,B) To create smooth curves for movement paths,C) To add special effects,D) To adjust the color balance,Answer: B
"Q. What is ""rendering"" in animation?",A) The process of creating character designs,"B) The final step in producing an animation, where images are generated from the scenes",C) The addition of sound effects,D) The creation of storyboard sketches,Answer: B
Q. Which animation technique involves creating movement by filming physical objects frame by frame?,A) Rotoscoping,B) Stop motion,C) CGI animation,D) Flash animation,Answer: B
"Q. What is the purpose of ""tweening"" in animation?",A) To create smooth transitions between keyframes,B) To add texture to characters,C) To add background music,D) To create a looping effect,Answer: A
"Q. Who is considered the pioneer of stop-motion animation, known for films like ""King Kong""?",A) Ray Harryhausen,B) Hayao Miyazaki,C) Walt Disney,D) Tim Burton,Answer: A
Q. Which animation technique involves tracing over live-action film movement to create realistic animation?,A) 2D animation,B) Rotoscoping,C) Stop motion,D) Claymation,Answer: B
"Q. What is ""cel animation"" in traditional 2D animation?",A) The use of celluloid sheets for each frame,B) The final editing stage,C) The creation of 3D characters,D) The addition of sound effects,Answer: A
"Q. What is the purpose of the ""squash and stretch"" principle in animation?",A) To simulate the impact of gravity on characters,B) To add humor to animations,C) To create depth and dimensionality,D) To add shading to characters,Answer: C
"Q. In computer animation, what does the term ""IK"" stand for?",A) Inverse Kinematics,B) Imaginary Kinetics,C) Impactful Keyframes,D) Intelligent Kinetics,Answer: A
Q. What is the term for the process of creating movement by rapidly displaying a sequence of still images?,A) Morphing,B) Rendering,C) Animation,D) GIF creation,Answer: C
Q. Which animated film is often credited as the first feature-length animated film?,"A) ""Toy Story""","B) ""Snow White and the Seven Dwarfs""","C) ""Finding Nemo""","D) ""Shrek""",Answer: B
"Q. What is the purpose of the ""anticipation"" principle in animation?",A) To create a sense of excitement,B) To prepare the audience for a major event,C) To convey the idea that an action is about to occur,D) To add suspense to the storyline,Answer: C
Q. Which animation technique involves creating movement by manipulating two-dimensional images in a three-dimensional space?,A) Stop motion,B) Rotoscoping,C) 3D animation,D) Cel animation,Answer: C
"Q. What is the purpose of the ""secondary action"" principle in animation?",A) To create the primary movement,B) To add complexity and richness to the animation,C) To add background music,D) To add sound effects,Answer: B
