Question,optionA,optionB,optionC,optionD,Answer
Q. What is the term for the written symbols used to represent music notes?,A) Lyrics,B) Chords,C) Notation,D) Harmony,Answer: C
"Q. In music, what does the term ""fortissimo"" indicate?",A) Slow tempo,B) Soft volume,C) Fast tempo,D) Loud volume,Answer: D
"Q. Who is often referred to as the ""King of Pop"" in the music industry?",A) Michael Jackson,B) Elvis Presley,C) Madonna,D) Beyoncé,Answer: A
"Q. Which instrument is known as the ""king of instruments"" in classical music?",A) Violin,B) Piano,C) Flute,D) Trumpet,Answer: B
Q. What is the name of the structure in music where the main theme is repeated and varied?,A) Rondo,B) Sonata,C) Symphony,D) Concerto,Answer: A
"Q. Who composed the famous piece ""Für Elise""?",A) Ludwig van Beethoven,B) Wolfgang Amadeus Mozart,C) Johann Sebastian Bach,D) Franz Schubert,Answer: A
"Q. In jazz music, what does the term ""improvisation"" refer to?",A) Playing written notes,B) Playing without a score,C) Playing in a large ensemble,D) Playing at a slow tempo,Answer: B
Q. What is the term for a group of musicians playing together in an orchestra or band?,A) Choir,B) Ensemble,C) Quartet,D) Soloist,Answer: B
Q. Which genre of music is characterized by its origins in African American communities and a strong rhythm and blues influence?,A) Country,B) Rock,C) Jazz,D) Hip-hop,Answer: D
"Q. Who is known as the ""Queen of Soul"" in the music industry?",A) Whitney Houston,B) Aretha Franklin,C) Beyoncé,D) Adele,Answer: B
"Q. In music, what does the term ""allegro"" indicate?",A) Slow tempo,B) Fast tempo,C) Soft volume,D) Loud volume,Answer: B
Q. Which Beatles album is often considered one of the greatest of all time?,A) Abbey Road,B) Sgt. Pepper's Lonely Hearts Club Band,C) The White Album,D) Let It Be,Answer: B
Q. Who is known for playing the electric guitar with his teeth and behind his back?,A) Eric Clapton,B) Jimi Hendrix,C) Jimmy Page,D) Eddie Van Halen,Answer: B
Q. What is the name of the traditional Japanese stringed instrument played with a plectrum?,A) Shakuhachi,B) Koto,C) Shamisen,D) Taiko,Answer: C
Q. Which musical term refers to the gradual increase in volume?,A) Crescendo,B) Decrescendo,C) Legato,D) Staccato,Answer: A
"Q. In music theory, what is the term for a rapid succession of notes played one after the other?",A) Arpeggio,B) Glissando,C) Trill,D) Tremolo,Answer: C
"Q. What is the name of the small, high-pitched woodwind instrument often used in marching bands?",A) Clarinet,B) Oboe,C) Piccolo,D) Bassoon,Answer: C
"Q. Who composed the famous ""Moonlight Sonata""?",A) Franz Schubert,B) Ludwig van Beethoven,C) Wolfgang Amadeus Mozart,D) Johann Sebastian Bach,Answer: B
Q. What is the name of the percussion instrument consisting of a set of tuned wooden bars struck with mallets?,A) Xylophone,B) Marimba,C) Vibraphone,D) Glockenspiel,Answer: A
"Q. In opera, what is the term for a solo song, typically expressing a character's emotions?",A) Overture,B) Aria,C) Duet,D) Recitative,Answer: B
"Q. Who is often referred to as the ""Godfather of Soul"" in the music industry?",A) Ray Charles,B) James Brown,C) Marvin Gaye,D) Stevie Wonder,Answer: B
"Q. In music notation, what does the symbol ""p"" indicate?",A) Fast tempo,B) Soft volume,C) Loud volume,D) Slow tempo,Answer: B
Q. What is the name of the traditional Indian drum played with the hands?,A) Tabla,B) Sitar,C) Santoor,D) Bansuri,Answer: A
"Q. Who is known for playing the violin while standing on one leg, often in a rock and roll style?",A) Itzhak Perlman,B) Joshua Bell,C) David Garrett,D) Nigel Kennedy,Answer: D
Q. What is the term for the simultaneous combination of three or more musical notes in harmony?,A) Octave,B) Chord,C) Scale,D) Arpeggio,Answer: B
Q. Which musical genre is known for its origins in the Appalachian region and features the banjo as a prominent instrument?,A) Bluegrass,B) Blues,C) Reggae,D) Flamenco,Answer: A
"Q. Who composed the famous ""Four Seasons"" concertos?",A) Antonio Vivaldi,B) Johann Sebastian Bach,C) Wolfgang Amadeus Mozart,D) Pyotr Ilyich Tchaikovsky,Answer: A
"Q. In music, what is the term for the gradual decrease in volume?",A) Crescendo,B) Decrescendo,C) Legato,D) Staccato,Answer: B
Q. What is the name of the percussion instrument consisting of a set of metal bars struck with mallets?,A) Marimba,B) Xylophone,C) Vibraphone,D) Glockenspiel,Answer: D
"Q. Who is known as the ""Piano Man"" and is a highly acclaimed singer-songwriter and pianist?",A) Elton John,B) Billy Joel,C) John Lennon,D) Paul McCartney,Answer: B
