Question,Option A,Option B,Option C,Option D,Answer
Q. What is the aperture of a camera lens?,A) The size of the lens opening,B) The focal length,C) The shutter speed,D) The ISO setting,Answer: A
Q. Which camera setting controls the amount of light entering the camera?,A) Aperture,B) ISO,C) Shutter speed,D) White balance,Answer: A
"Q. What does the term ""exposure triangle"" refer to in photography?","A) The relationship between aperture, shutter speed, and ISO",B) The three primary colors used in digital photography,C) The three main types of lighting setups,D) The three stages of editing a photograph,Answer: A
Q. What is the purpose of the shutter speed in photography?,A) To control the amount of light entering the camera,B) To adjust the depth of field,C) To freeze or blur motion,D) To enhance color saturation,Answer: C
Q. What does ISO stand for in photography?,A) International Shutter Organization,B) Image Sensitivity Option,C) International Standards Organization,"D) ISO doesn't stand for anything, it's just a standard",Answer: C
Q. How does increasing the ISO affect a photograph?,A) It makes the image brighter,B) It increases the depth of field,C) It decreases image noise,D) It slows down the shutter speed,Answer: A
Q. What is the purpose of white balance in photography?,A) To adjust the overall exposure of the image,B) To control the contrast,C) To adjust the color temperature of the image,D) To add creative filters to the image,Answer: C
"Q. What does the term ""depth of field"" refer to in photography?",A) The distance between the camera and the subject,B) The sharpness of the image from foreground to background,C) The width of the lens aperture,D) The angle of view of the lens,Answer: B
Q. Which type of lens would be best suited for photographing distant subjects?,A) Wide-angle lens,B) Telephoto lens,C) Macro lens,D) Prime lens,Answer: B
"Q. What does the term ""bokeh"" refer to in photography?",A) The amount of light entering the camera,B) The sharpness of an image,C) The aesthetic quality of the out-of-focus areas in a photograph,D) The distance between the camera and the subject,Answer: C
Q. What is the rule of thirds in photography?,A) A composition technique where the subject is placed off-center,B) A method for adjusting exposure in-camera,C) A rule for selecting the appropriate ISO setting,D) A technique for creating motion blur,Answer: A
Q. What is the purpose of a polarizing filter in photography?,A) To protect the lens from scratches,B) To reduce glare and reflections,C) To add vignetting to the image,D) To increase the depth of field,Answer: B
Q. What is the golden hour in photography?,A) The time of day when the sun is highest in the sky,B) The time just before sunset or just after sunrise when the light is soft and warm,C) The time when the moon is visible in the sky,D) The time when the stars are most visible,Answer: B
Q. What is the histogram in photography?,A) A graph showing the distribution of tones in an image,B) A type of camera lens,C) A tool for adjusting color balance,D) A technique for creating double exposure images,Answer: A
Q. What is the difference between RAW and JPEG file formats in photography?,A) RAW files are uncompressed and contain more data than JPEG files,B) RAW files are smaller in size compared to JPEG files,C) JPEG files are better for post-processing,D) There is no difference between RAW and JPEG file formats,Answer: A
Q. What is bracketing in photography?,A) Taking multiple shots of the same scene at different exposures,B) Attaching additional lenses to the camera,C) Using a tripod to stabilize the camera,D) Adjusting the white balance of the image,Answer: A
Q. What is the purpose of a tripod in photography?,A) To protect the camera from damage,B) To stabilize the camera and reduce camera shake,C) To add a creative blur effect to the image,D) To change the perspective of the image,Answer: B
Q. What is the difference between a prime lens and a zoom lens?,"A) Prime lenses have a fixed focal length, while zoom lenses can vary their focal length",B) Prime lenses are better for low-light situations,C) Zoom lenses are lighter and more portable,D) There is no difference between prime and zoom lenses,Answer: A
"Q. What does the term ""dynamic range"" refer to in photography?",A) The range of colors in an image,B) The range of focal lengths a lens can achieve,C) The range of tones between the darkest and lightest areas of an image,D) The range of ISO settings available on a camera,Answer: C
Q. What is the purpose of the self-timer function on a camera?,A) To adjust the aperture of the lens,B) To trigger the flash,C) To delay the shutter release for a few seconds,D) To switch between different autofocus modes,Answer: C
Q. What is the best way to achieve proper exposure in a photograph?,A) Using automatic mode on the camera,B) Adjusting the aperture until the image looks right,C) Using a light meter to measure the light in the scene,D) Using the exposure compensation dial on the camera,Answer: C
Q. What is the difference between a DSLR and a mirrorless camera?,"A) DSLRs use a mirror to reflect the image into the viewfinder, while mirrorless cameras do not have a mirror",B) DSLRs are smaller and more compact than mirrorless cameras,C) Mirrorless cameras have better image quality than DSLRs,D) There is no difference between DSLRs and mirrorless cameras,Answer: A
Q. What is the purpose of the viewfinder on a camera?,A) To protect the lens from dust and scratches,B) To preview the composition of the image,C) To stabilize the camera,D) To adjust the focus of the lens,Answer: B
Q. What is the difference between optical zoom and digital zoom?,"A) Optical zoom uses lens elements to magnify the image, while digital zoom enlarges the image digitally",B) Optical zoom is better for low-light situations,C) Digital zoom produces higher-quality images than optical zoom,D) There is no difference between optical zoom and digital zoom,Answer: A
Q. What is the purpose of the hot shoe on a camera?,A) To attach additional lenses,B) To connect the camera to a computer,C) To mount accessories like a flash or external microphone,D) To adjust the white balance of the image,Answer: C
"Q. What does the term ""leading lines"" refer to in photography?",A) Lines in the frame that lead the viewer's eye to the main subject,B) Lines created by the intersection of light and shadow,C) Lines that separate the foreground from the background,D) Lines that represent movement in the image,Answer: A
Q. What is the purpose of the exposure compensation dial on a camera?,A) To adjust the aperture of the lens,B) To switch between different autofocus modes,C) To compensate for over or underexposure in the image,D) To control the amount of light entering the camera,Answer: C
"Q. What does the term ""panning"" refer to in photography?",A) A technique for adjusting the focus of the lens,B) A method for stabilizing the camera,C) A technique for creating motion blur by following a moving subject with the camera,D) A type of lens filter,Answer: C
Q. What is the best way to clean camera lenses?,A) Using a soft cloth or brush,B) Using compressed air,C) Using water and soap,D) Using a paper towel,Answer: A
